Title,Original Title,Subtitle,Series,Volume,Author,"Author (Last, First)",Illustrator,Narrator,Translator,Photographer,Editor,Publisher,Place of Publication,Date Published,Year Published,Original Date Published,Original Year Published,Edition,Genre,Summary,Guided Reading Level,Lexile Measure,Lexile Code,Grade Level Equivalent,Developmental Reading Assessment,Interest Level,AR Level,AR Points,AR Quiz Number,Word Count,Number of Pages,Format,Audio Runtime,Dimensions,Weight,List Price,Language,Original Language,DDC,LCC,LCCN,OCLC,ISBN,ISSN,Favorites,Rating,Physical Location,Status,Status Incompleted Reason,Status Hidden,Date Started,Date Finished,Current Page,Loaned To,Date Loaned,Borrowed From,Date Borrowed,Returned from Borrow,Not Owned Reason,Quantity,Condition,Recommended By,Date Added,User Supplied ID,User Supplied Descriptor,Tags,Purchase Date,Purchase Place,Purchase Price,Notes,Google VolumeID,Category,Wish List,Previously Owned,Up Next,Position,Uploaded Image URL,Activities
Antifragile,,Things That Gain from Disorder,,,Nassim Nicholas Taleb,"Taleb, Nassim Nicholas",,,,,,Random House Publishing Group,,2012/11/27,2012,,,,Business & Economics,"Antifragile is a standalone book in Nassim Nicholas Taleb’s landmark Incerto series, an investigation of opacity, luck, uncertainty, probability, human error, risk, and decision-making in a world we don’t understand. The other books in the series are Fooled by Randomness, The Black Swan, Skin in the Game, and The Bed of Procrustes.Nassim Nicholas Taleb, the bestselling author of The Black Swan and one of the foremost thinkers of our time, reveals how to thrive in an uncertain world. Just as human bones get stronger when subjected to stress and tension, and rumors or riots intensify when someone tries to repress them, many things in life benefit from stress, disorder, volatility, and turmoil. What Taleb has identified and calls “antifragile” is that category of things that not only gain from chaos but need it in order to survive and flourish.   In The Black Swan, Taleb showed us that highly improbable and unpredictable events underlie almost everything about our world. In Antifragile, Taleb stands uncertainty on its head, making it desirable, even necessary, and proposes that things be built in an antifragile manner. The antifragile is beyond the resilient or robust. The resilient resists shocks and stays the same; the antifragile gets better and better.  Furthermore, the antifragile is immune to prediction errors and protected from adverse events. Why is the city-state better than the nation-state, why is debt bad for you, and why is what we call “efficient” not efficient at all? Why do government responses and social policies protect the strong and hurt the weak? Why should you write your resignation letter before even starting on the job? How did the sinking of the Titanic save lives? The book spans innovation by trial and error, life decisions, politics, urban planning, war, personal finance, economic systems, and medicine. And throughout, in addition to the street wisdom of Fat Tony of Brooklyn, the voices and recipes of ancient wisdom, from Roman, Greek, Semitic, and medieval sources, are loud and clear. Antifragile is a blueprint for living in a Black Swan world. Erudite, witty, and iconoclastic, Taleb’s message is revolutionary: The antifragile, and only the antifragile, will make it.Praise for Antifragile“Ambitious and thought-provoking . . . highly entertaining.”—The Economist “A bold book explaining how and why we should embrace uncertainty, randomness, and error . . . It may just change our lives.”—Newsweek",,,,,,,,,,,544,,,,,,英语,,,,,,9780679645276,,0,0.000000,,Unread,,0,,,,,,,,0,,,,,2021/11/21 14:38:18.227020978,,,,,,,,5fqbz_qGi0AC,,0,0,0,,,
Beyond Infinity,,An expedition to the outer limits of the mathematical universe,,,Eugenia Cheng,"Cheng, Eugenia",,,,,,Profile Books,,2017/03/09,2017,,,,Mathematics,"SHORTLISTED FOR THE 2017 ROYAL SOCIETY SCIENCE BOOK PRIZE Even small children know there are infinitely many whole numbers - start counting and you'll never reach the end. But there are also infinitely many decimal numbers between zero and one. Are these two types of infinity the same? Are they larger or smaller than each other? Can we even talk about 'larger' and 'smaller' when we talk about infinity? In Beyond Infinity, international maths sensation Eugenia Cheng reveals the inner workings of infinity.What happens when a new guest arrives at your infinite hotel - but you already have an infinite number of guests? How does infinity give Zeno's tortoise the edge in a paradoxical foot-race with Achilles? And can we really make an infinite number of cookies from a finite amount of cookie dough?Wielding an armoury of inventive, intuitive metaphor, Cheng draws beginners and enthusiasts alike into the heart of this mysterious, powerful concept to reveal fundamental truths about mathematics, all the way from the infinitely large down to the infinitely small.",,,,,,,,,,,284,,,,,,英语,,,,,,9781782830818,,0,0.000000,,Unread,,0,,,,,,,,0,,,,,2021/11/27 00:33:12.388736009,,,,,,,,EPQ8DgAAQBAJ,,0,0,0,,,
Categories for the Working Mathematician,,,,,Saunders MacLane,"MacLane, Saunders",,,,,,Springer Science & Business Media,,2013/11/11,2013,,,,Mathematics,"Category Theory has developed rapidly. This book aims to present those ideas and methods which can now be effectively used by Mathe maticians working in a variety of other fields of Mathematical research. This occurs at several levels. On the first level, categories provide a convenient conceptual language, based on the notions of category, functor, natural transformation, contravariance, and functor category. These notions are presented, with appropriate examples, in Chapters I and II. Next comes the fundamental idea of an adjoint pair of functors. This appears in many substantially equivalent forms: That of universal construction, that of direct and inverse limit, and that of pairs offunctors with a natural isomorphism between corresponding sets of arrows. All these forms, with their interrelations, are examined in Chapters III to V. The slogan is ""Adjoint functors arise everywhere"". Alternatively, the fundamental notion of category theory is that of a monoid -a set with a binary operation of multiplication which is associative and which has a unit; a category itself can be regarded as a sort of general ized monoid. Chapters VI and VII explore this notion and its generaliza tions. Its close connection to pairs of adjoint functors illuminates the ideas of universal algebra and culminates in Beck's theorem characterizing categories of algebras; on the other hand, categories with a monoidal structure (given by a tensor product) lead inter alia to the study of more convenient categories of topological spaces.",,,,,,,,,,,262,,,,,,英语,,,,,,9781461298397,,0,0.000000,,Unread,,0,,,,,,,,0,,,,,2021/11/27 00:47:34.506551027,,,,,,,,6KPSBwAAQBAJ,,0,0,0,,,
Classical Mechanics,,,,,Herbert Goldstein,"Goldstein, Herbert",,,,,,Pearson India,,,2011,,,,Engineering,"This classic text enables students to make connections between classical and modern physics - an indispensable part of a physicist's education. In this new edition, Beams Medal winner Charles Poole and John Safko have updated the text to include the latest topics, applications, and notation, to reflect today's physics curriculum. They introduce students to the increasingly important role that nonlinearities play in contemporary applications of classical mechanics. New numerical exercises help students to develop skills in how to use computer techniques to solve problems in physics. Mathematical techniques are presented in detail so that the text remains fully accessible to students who have not had an intermediate course in classical mechanics.",,,,,,,,,,,665,,,,,,英语,,,,,,9788131758915,,0,0.000000,,Unread,,0,,,,,,,,0,,,,,2021/12/04 01:20:28.777107954,,,,,,,,tVeFlb9tTxgC,,0,0,0,,,
Clean Architecture,,A Craftsman's Guide to Software Structure and Design,,,Robert C. Martin,"Martin, Robert C.",,,,,,Prentice Hall,,2017/09/12,2017,,,,Computers,"Practical Software Architecture Solutions from the Legendary Robert C. Martin (“Uncle Bob”)    By applying universal rules of software architecture, you can dramatically improve developer productivity throughout the life of any software system. Now, building upon the success of his best-selling books Clean Code and The Clean Coder, legendary software craftsman Robert C. Martin (“Uncle Bob”) reveals those rules and helps you apply them.   Martin’s  Clean Architecture  doesn’t merely present options. Drawing on over a half-century of experience in software environments of every imaginable type, Martin tells you what choices to make and why they are critical to your success. As you’ve come to expect from Uncle Bob, this book is packed with direct, no-nonsense solutions for the real challenges you’ll face–the ones that will make or break your projects.  Learn what software architects need to achieve–and core disciplines and practices for achieving it Master essential software design principles for addressing function, component separation, and data management See how programming paradigms impose discipline by restricting what developers can do Understand what’s critically important and what’s merely a “detail” Implement optimal, high-level structures for web, database, thick-client, console, and embedded applications Define appropriate boundaries and layers, and organize components and services See why designs and architectures go wrong, and how to prevent (or fix) these failures    Clean Architecture  is essential reading for every current or aspiring software architect, systems analyst, system designer, and software manager–and for every programmer who must execute someone else’s designs.       Register your product for convenient access to downloads, updates, and/or corrections as they become available.",,,,,,,,,,,432,,,,,,英语,,,,,,9780134494326,,0,0.000000,,Unread,,0,,,,,,,,0,,,,,2021/11/23 10:38:17.551347017,,,,,,,,uGE1DwAAQBAJ,,0,0,0,,https://images-na.ssl-images-amazon.com/images/I/51JF95r45vL._SY445_QL70_.jpg,
Code Complete,,,,,Steve McConnell,"McConnell, Steve",,,,,,Pearson Education,,2004/06/09,2004,,,,Computers,"Widely considered one of the best practical guides to programming, Steve McConnell’s original CODE COMPLETE has been helping developers write better software for more than a decade. Now this classic book has been fully updated and revised with leading-edge practices—and hundreds of new code samples—illustrating the art and science of software construction. Capturing the body of knowledge available from research, academia, and everyday commercial practice, McConnell synthesizes the most effective techniques and must-know principles into clear, pragmatic guidance. No matter what your experience level, development environment, or project size, this book will inform and stimulate your thinking—and help you build the highest quality code.  Discover the timeless techniques and strategies that help you:   Design for minimum complexity and maximum creativity Reap the benefits of collaborative development Apply defensive programming techniques to reduce and flush out errors Exploit opportunities to refactor—or evolve—code, and do it safely Use construction practices that are right-weight for your project Debug problems quickly and effectively Resolve critical construction issues early and correctly Build quality into the beginning, middle, and end of your project",,,,,,,,,,,99998,,,,,,英语,,,,,,9780735636972,,0,0.000000,,Unread,,0,,,,,,,,0,,,,,2021/11/23 10:40:14.943799018,,,,,,,,LpVCAwAAQBAJ,,0,0,0,,,
Combinatorics and Graph Theory,,,,,"John Harris,Jeffry L. Hirst,Michael Mossinghoff","Harris, John",,,,,,Springer Science & Business Media,,2009/04/03,2009,,,,Mathematics,"There are certain rules that one must abide by in order to create a successful sequel. — Randy Meeks, from the trailer to Scream 2 While we may not follow the precise rules that Mr. Meeks had in mind for s- cessful sequels, we have made a number of changes to the text in this second edition. In the new edition, we continue to introduce new topics with concrete - amples, we provide complete proofs of almost every result, and we preserve the book’sfriendlystyle andlivelypresentation,interspersingthetextwith occasional jokes and quotations. The rst two chapters, on graph theory and combinatorics, remain largely independent, and may be covered in either order. Chapter 3, on in nite combinatorics and graphs, may also be studied independently, although many readers will want to investigate trees, matchings, and Ramsey theory for nite sets before exploring these topics for in nite sets in the third chapter. Like the rst edition, this text is aimed at upper-division undergraduate students in mathematics, though others will nd much of interest as well. It assumes only familiarity with basic proof techniques, and some experience with matrices and in nite series. The second edition offersmany additionaltopics for use in the classroom or for independentstudy. Chapter 1 includesa new sectioncoveringdistance andrelated notions in graphs, following an expanded introductory section. This new section also introduces the adjacency matrix of a graph, and describes its connection to important features of the graph.",,,,,,,,,,,381,,,,,,英语,,,,,,9780387797113,,0,0.000000,,Unread,,0,,,,,,,,0,,,,,2021/11/27 00:38:25.612992048,,,,,,,,DfcQaZKUVLwC,,0,0,0,,,
Concrete Mathematics: A Foundation for Computer Science,,,,,Ronald L. Graham,"Graham, Ronald L.",,,,,,Pearson Education,,,1994,,,,Asymptotic expansions,,,,,,,,,,,,642,,,,,,英语,,,,,,9788131708415,,0,0.000000,,Unread,,0,,,,,,,,0,,,,,2021/11/23 10:36:02.518401145,,,,,,,,bRr2IvwTJaEC,,0,0,0,,,
Contemporary Abstract Algebra,,,,,Joseph Gallian,"Gallian, Joseph",,,,,,Cengage Learning,,2016/01/01,2016,,,,Mathematics,"CONTEMPORARY ABSTRACT ALGEBRA, NINTH EDITION provides a solid introduction to the traditional topics in abstract algebra while conveying to students that it is a contemporary subject used daily by working mathematicians, computer scientists, physicists, and chemists. The text includes numerous figures, tables, photographs, charts, biographies, computer exercises, and suggested readings giving the subject a current feel which makes the content interesting and relevant for students.Important Notice: Media content referenced within the product description or the product text may not be available in the ebook version.",,,,,,,,,,,656,,,,,,英语,,,,,,9781305887855,,0,0.000000,,Unread,,0,,,,,,,,0,,,,,2021/11/27 00:34:43.374449968,,,,,,,,JMUaCgAAQBAJ,,0,0,0,,,
Decoding Greatness,,How the Best in the World Reverse Engineer Success,,,Ron Friedman,"Friedman, Ron",,,,,,Simon and Schuster,,2021/06/15,2021,,,,Business & Economics,"NATIONAL BESTSELLER For readers of Atomic Habits, Deep Work, and Peak comes a game-changing approach to mastering new skills and succeeding faster.For generations, we’ve been taught there are two ways to succeed—either from talent or practice. In Decoding Greatness, award-winning social psychologist Ron Friedman illuminates a powerful third path—one that has quietly launched icons in a wide range of fields, from artists, writers, and chefs, to athletes, inventors, and entrepreneurs: reverse engineering. To reverse engineer is to look beyond what is evident on the surface and find a hidden structure. It’s the ability to taste an intoxicating dish and deduce its recipe, to listen to a beautiful song and discern its chord progression, to watch a horror film and grasp its narrative arc.  Using eye-opening examples of top performers—from Agatha Christie to Andy Warhol, Barack Obama to Serena Williams—and groundbreaking research on pattern recognition, skill acquisition, and creative genius, Friedman reveals the staggering power of reverse engineering and teaches you how to harness this vital skill for yourself. You’ll learn how to take apart models you admire, pinpoint precisely what makes them work, and apply that knowledge to develop novel ideas, methods, and products that are uniquely your own. Along the way, you’ll meet the culinary detective who exposes top-secret recipes, the burglar who can visit a bank and recreate its blueprints, and the celebrated artist who reverse engineered his way to the top of his profession without any formal education. You don’t have to be a genius to achieve greatness, but you do need a method for getting there. Bursting with unforgettable stories and actionable strategies, Decoding Greatness is an indispensable guide to learning from the best, improving your skills, and sparking breakthrough ideas.",,,,,,,,,,,288,,,,,,英语,,,,,,9781982135799,,0,0.000000,,Unread,,0,,,,,,,,0,,,,,2022/02/08 08:39:18.115411996,,,,,,,,-lwzEAAAQBAJ,,0,0,0,,,
Designing Data-Intensive Applications,,"The Big Ideas Behind Reliable, Scalable, and Maintainable Systems",,,Martin Kleppmann,"Kleppmann, Martin",,,,,,"""O'Reilly Media, Inc.""",,2017/03/16,2017,,,,Computers,"Data is at the center of many challenges in system design today. Difficult issues need to be figured out, such as scalability, consistency, reliability, efficiency, and maintainability. In addition, we have an overwhelming variety of tools, including relational databases, NoSQL datastores, stream or batch processors, and message brokers. What are the right choices for your application? How do you make sense of all these buzzwords?In this practical and comprehensive guide, author Martin Kleppmann helps you navigate this diverse landscape by examining the pros and cons of various technologies for processing and storing data. Software keeps changing, but the fundamental principles remain the same. With this book, software engineers and architects will learn how to apply those ideas in practice, and how to make full use of data in modern applications.Peer under the hood of the systems you already use, and learn how to use and operate them more effectivelyMake informed decisions by identifying the strengths and weaknesses of different toolsNavigate the trade-offs around consistency, scalability, fault tolerance, and complexityUnderstand the distributed systems research upon which modern databases are builtPeek behind the scenes of major online services, and learn from their architectures",,,,,,,,,,,616,,,,,,英语,,,,,,9781491903100,,0,0.000000,,Unread,,0,,,,,,,,0,,,,,2021/11/23 10:38:52.288639068,,,,,,,,p1heDgAAQBAJ,,0,0,0,,,
Differential Equations and Their Applications,,An Introduction to Applied Mathematics,,,M. Braun,"Braun, M.",,,,,,Springer Science & Business Media,,2013/06/29,2013,,,,Mathematics,"For the past several years the Division of Applied Mathematics at Brown University has been teaching an extremely popular sophomore level differential equations course. The immense success of this course is due primarily to two fac tors. First, and foremost, the material is presented in a manner which is rigorous enough for our mathematics and ap plied mathematics majors, but yet intuitive and practical enough for our engineering, biology, economics, physics and geology majors. Secondly, numerous case histories are given of how researchers have used differential equations to solve real life problems. This book is the outgrowth of this course. It is a rigorous treatment of differential equations and their appli cations, and can be understood by anyone who has had a two semester course in Calculus. It contains all the material usually covered in a one or two semester course in differen tial equations. In addition, it possesses the following unique features which distinguish it from other textbooks on differential equations.",,,,,,,,,,,719,,,,,,英语,,,,,,9781475749694,,0,0.000000,,Unread,,0,,,,,,,,0,,,,,2021/11/27 00:39:15.316022872,,,,,,,,TvbiBwAAQBAJ,,0,0,0,,,
Elementary Number Theory,,,,,"Gareth A. Jones,Josephine M. Jones","Jones, Gareth A.",,,,,,Springer Science & Business Media,,1998/07/31,1998,,,,Mathematics,"Our intention in writing this book is to give an elementary introduction to number theory which does not demand a great deal of mathematical back ground or maturity from the reader, and which can be read and understood with no extra assistance. Our first three chapters are based almost entirely on A-level mathematics, while the next five require little else beyond some el ementary group theory. It is only in the last three chapters, where we treat more advanced topics, including recent developments, that we require greater mathematical background; here we use some basic ideas which students would expect to meet in the first year or so of a typical undergraduate course in math ematics. Throughout the book, we have attempted to explain our arguments as fully and as clearly as possible, with plenty of worked examples and with outline solutions for all the exercises. There are several good reasons for choosing number theory as a subject. It has a long and interesting history, ranging from the earliest recorded times to the present day (see Chapter 11, for instance, on Fermat's Last Theorem), and its problems have attracted many of the greatest mathematicians; consequently the study of number theory is an excellent introduction to the development and achievements of mathematics (and, indeed, some of its failures). In particular, the explicit nature of many of its problems, concerning basic properties of inte gers, makes number theory a particularly suitable subject in which to present modern mathematics in elementary terms.",,,,,,,,,,,302,,,,,,英语,,,,,,9783540761976,,0,0.000000,,Unread,,0,,,,,,,,0,,,,,2021/11/27 00:37:45.255774021,,,,,,,,5YBwrzrYk2kC,,0,0,0,,,
